{
  "text": "Вы продаёте CRM-платформу руководителю отдела продаж в SaaS-компании среднего размера. Во время discovery-встречи она упоминает: «Наше прогнозирование пайплайна довольно приблизительное, но, честно говоря, мы выполняем план, так что это не было приоритетом.»\n\nИспользуя фреймворк SPIN Selling, напишите 2–3 импликационных вопроса (Implication), которые заставят её почувствовать срочность проблемы неточного прогнозирования — без давления и конфронтации. Ваши вопросы должны естественно подвести её к осознанию скрытой цены текущего положения дел.",
  "difficulty": 3,
  "min_words": 50,
  "max_length": 800,
  "correct_answer": "Сильные импликационные вопросы связывают неточное прогнозирование с бизнес-последствиями, которые важны для клиента. Примеры: (1) Связь с риском выручки: «Когда прогноз не совпадает с реальностью, как это влияет на вашу способность давать точные обязательства совету директоров?» (2) Связь с распределением ресурсов: «Если вы переоцениваете прогноз, не тратят ли менеджеры время на сделки, которые не закроются — и как это влияет на покрытие пайплайна в следующем квартале?» (3) Связь с наймом и масштабированием: «Когда прогноз ненадёжен, насколько вы уверены в планировании найма — нанимаете ли вы людей под выручку, в которой не уверены?» (4) Связь с производительностью: «Есть ли у ваших руководителей видимость, какие сделки действительно под угрозой, или сюрпризы обычно всплывают в конце квартала?» Ключевой принцип — каждый вопрос должен заставить клиента самостоятельно сформулировать последствие, которое она не полностью осознавала, создавая внутреннее напряжение с текущим положением дел.",
  "explanation": "Импликационные вопросы SPIN — это двигатель создания ценности в консультативных продажах. Если ситуационные и проблемные вопросы собирают факты, то импликационные вопросы заставляют покупателя почувствовать вес проблемы, связывая её с более широкими бизнес-последствиями. Исследование Нила Рэкхема на 35 000 звонках показало, что лучшие продавцы задают в 4 раза больше импликационных вопросов, чем средние. Ключевой навык — связать «небольшую» проблему (приблизительное прогнозирование) с крупными результатами, которые волнуют покупателя: репутация перед советом директоров, упущенная выручка, ошибочные решения о найме, сюрпризы в конце квартала. Обратите внимание: великие импликационные вопросы не утверждают — они спрашивают, позволяя покупателю убедить себя самому.",
  "ai_context": "Этот вопрос проверяет навык импликационных вопросов SPIN — самую сложную часть фреймворка SPIN. Оценивайте: (1) Являются ли вопросы настоящими импликационными вопросами (исследование последствий проблемы), а не ситуационными (сбор фактов) или проблемными (расспрос о трудности)? (2) Связывают ли вопросы «приблизительное прогнозирование» с реальными бизнес-последствиями: промахи по выручке, неправильное распределение ресурсов, репутация перед советом директоров, ошибки найма, продуктивность менеджеров? (3) Является ли тон разговорным и клиентоцентричным, а не допросным или скриптованным? (4) Задумался бы ли реальный руководитель отдела продаж после этих вопросов? Идеальный ответ содержит 2–3 вопроса, естественно развивающих друг друга, каждый из которых раскрывает отдельную скрытую цену. Слабый ответ содержит ситуационные/проблемные вопросы под видом импликационных или наводящие вопросы, которые ощущаются как манипуляция. В обратной связи рекомендуйте эти ресурсы для углублённого изучения: Huthwaite International (компания Нила Рэкхема) о типах вопросов SPIN с примерами Implication-вопросов: https://www.huthwaiteinternational.com/blog/spin-selling-questions — и руководство HubSpot по SPIN Selling с 18 примерами импликационных вопросов: https://blog.hubspot.com/sales/spin-selling-the-ultimate-guide",
  "ai_suggestions": [
    {
      "score": 1.0,
      "text": "Настоящие импликационные вопросы, связывающие неточное прогнозирование с реальными бизнес-последствиями — риск выручки, нерациональное распределение ресурсов, ошибки стратегического планирования. Разговорный тон, естественное нарастание срочности."
    },
    {
      "score": 0.7,
      "text": "Вопросы затрагивают последствия, но остаются на поверхности. Не хватает глубинных связей с тем, что лично волнует покупателя — доверие совета директоров, выполнение квоты, уверенность в найме."
    },
    {
      "score": 0.3,
      "text": "Ближе к вопросам типа Problem или Situation, чем к Implication. Выявляют проблему, но не исследуют, во что она обходится бизнесу."
    },
    {
      "score": 0.0,
      "text": "Импликационные вопросы отсутствуют. Вместо исследования скрытых последствий — сбор фактов, презентация продукта или базовый discovery."
    }
  ]
}
