{
  "text": "План безопасного прохода по знакам/буям (без привязки к системе).\n\nКонтекст:\nВы подходите к узкости/входу в марину. Видите боковые знаки, обозначающие кромки фарватера (левый/правый край в вашей локальной системе), и подозреваете мель рядом с предполагаемой траекторией. Есть картплоттер и эхолот, экипаж неопытный.\n\nЗадание:\nОпишите план безопасного прохода:\n1) Что делаете ДО входа (проверки, брифинг, настройки, план скорости).\n2) Как подтверждаете, что находитесь в безопасной воде (приборы/ориентиры, перекрёстная проверка).\n3) Что делаете, если глубина неожиданно уменьшается.\n4) Назовите 3 типичные ошибки новичков и как их предотвратить.\n\nВажно: не опирайтесь на цвета знаков; фокус на логике и перекрёстных проверках.",
  "difficulty": 4,
  "correct_answer": "До входа: заранее снизить скорость до безопасной; распределить роли (рулевой, наблюдатель, контроль глубины); коротко объяснить план и критерии отмены/выхода; выставить корректный масштаб карты; проверить единицы/датум; подготовить кранцы/швартовы при необходимости; убедиться в управляемости и реакции двигателя; учесть ветер/течение (снос).\n\nПодтверждение безопасной воды: не доверять одному источнику. Использовать одновременно трек на картплоттере + тренд глубины по эхолоту + визуальные ориентиры (знаки, створы/ведущие линии, если есть). Сверять позицию с ожидаемыми глубинами и геометрией фарватера. Держать консервативный запас от опасностей, не «срезать углы».\n\nЕсли глубина падает: немедленно уменьшить скорость, при необходимости стоп/нейтраль, и выйти назад по уже проверенному безопасному пути. Избегать резких поворотов на скорости. Перепроверить масштаб карты, позицию, допущения по уровню воды/приливу, и исправность датчиков. Если сомневаетесь — отменить заход и пересобрать план.\n\nТипичные ошибки: (1) заход на высокой скорости, (2) зависание в одном приборе с потерей визуального наблюдения, (3) «срезание» между знаками без понимания логики безопасной воды/с опорой на цвета, (4) отсутствие ролей и брифинга. Профилактика: скорость ниже заранее, роли, перекрёстные проверки и чёткий план отмены.",
  "explanation": "Проверяет практическую безопасность: подготовку, перекрёстные проверки и критерии отмены — то, что предотвращает посадку на мель.",
  "ai_context": "Смотрите: (1) подготовка и брифинг экипажа, (2) перекрёстная проверка (карта + эхолот + визуальные ориентиры), (3) дисциплина безопасной скорости, (4) конкретные действия при падении глубины, (5) типовые ошибки и меры, (6) отсутствие зависимости от «цветовых догадок».",
  "ai_suggestions": [
    {
      "score": 1,
      "text": "Чёткий план с ролями, перекрёстными проверками, критериями отмены и безопасной реакцией на падение глубины; сильная профилактика ошибок новичков."
    },
    {
      "score": 0.8,
      "text": "Хороший план, но отсутствует один важный элемент безопасности (например, критерии отмены или детали перекрёстной проверки)."
    },
    {
      "score": 0.5,
      "text": "Общие слова; нет ролей, конкретных шагов или плана на случай падения глубины."
    },
    {
      "score": 0.2,
      "text": "Опора в основном на цвета знаков или рискованные действия со скоростью/поворотами."
    },
    {
      "score": 0,
      "text": "Небезопасно или нерелевантно."
    }
  ],
  "min_words": 160,
  "max_length": 2400
}
