{
  "text": "\u041a\u043b\u0438\u0435\u043d\u0442 \u043f\u0438\u0448\u0435\u0442 \u0432 \u0447\u0430\u0442: \u00ab\u041a\u0443\u0440\u044c\u0435\u0440 \u0442\u0430\u043a \u0438 \u043d\u0435 \u043f\u0440\u0438\u0435\u0445\u0430\u043b. \u041c\u043d\u0435 \u043d\u0443\u0436\u0435\u043d \u0437\u0430\u043a\u0430\u0437 \u0441\u0435\u0433\u043e\u0434\u043d\u044f. \u0421\u0435\u0440\u0432\u0438\u0441 \u0443\u0436\u0430\u0441\u043d\u044b\u0439\u00bb.\n\n\u041d\u0430\u043f\u0438\u0448\u0438\u0442\u0435 \u0432\u0430\u0448 \u041f\u0415\u0420\u0412\u042b\u0419 \u043e\u0442\u0432\u0435\u0442 \u043a\u0430\u043a \u043e\u043f\u0435\u0440\u0430\u0442\u043e\u0440. \u041a\u043e\u0440\u043e\u0442\u043a\u043e (1\u20133 \u043f\u0440\u0435\u0434\u043b\u043e\u0436\u0435\u043d\u0438\u044f).",
  "difficulty": 2,
  "min_words": 10,
  "max_length": 600,
  "correct_answer": "\u0425\u043e\u0440\u043e\u0448\u0438\u0439 \u043e\u0442\u0432\u0435\u0442 \u043f\u0440\u0438\u0437\u043d\u0430\u0451\u0442 \u044d\u043c\u043e\u0446\u0438\u0438, \u0438\u0437\u0432\u0438\u043d\u044f\u0435\u0442\u0441\u044f \u0438 \u0441\u0440\u0430\u0437\u0443 \u043f\u0440\u0435\u0434\u043b\u0430\u0433\u0430\u0435\u0442 \u043a\u043e\u043d\u043a\u0440\u0435\u0442\u043d\u044b\u0439 \u0441\u043b\u0435\u0434\u0443\u044e\u0449\u0438\u0439 \u0448\u0430\u0433 + \u043a\u043b\u044e\u0447\u0435\u0432\u043e\u0439 \u0443\u0442\u043e\u0447\u043d\u044f\u044e\u0449\u0438\u0439 \u0432\u043e\u043f\u0440\u043e\u0441 (\u043d\u043e\u043c\u0435\u0440 \u0437\u0430\u043a\u0430\u0437\u0430 / \u0442\u0435\u043b\u0435\u0444\u043e\u043d / \u0430\u0434\u0440\u0435\u0441), \u0431\u0435\u0437 \u043e\u0431\u0432\u0438\u043d\u0435\u043d\u0438\u0439 \u043a\u043b\u0438\u0435\u043d\u0442\u0430.",
  "explanation": "\u041f\u0435\u0440\u0432\u043e\u0435 \u0441\u043e\u043e\u0431\u0449\u0435\u043d\u0438\u0435 \u0437\u0430\u0434\u0430\u0451\u0442 \u0442\u043e\u043d \u0438 \u0441\u043d\u0438\u0436\u0430\u0435\u0442 \u0440\u0438\u0441\u043a \u044d\u0441\u043a\u0430\u043b\u0430\u0446\u0438\u0438. \u0426\u0435\u043b\u044c: \u044d\u043c\u043f\u0430\u0442\u0438\u044f + \u043a\u043e\u043d\u0442\u0440\u043e\u043b\u044c \u0441\u0438\u0442\u0443\u0430\u0446\u0438\u0438 + \u0431\u044b\u0441\u0442\u0440\u044b\u0439 \u043f\u0435\u0440\u0435\u0445\u043e\u0434 \u043a \u043f\u0440\u043e\u0432\u0435\u0440\u043a\u0435 \u0444\u0430\u043a\u0442\u043e\u0432.",
  "ai_context": "\u0418\u0449\u0438\u0442\u0435: (1) \u044d\u043c\u043f\u0430\u0442\u0438\u044f/\u0438\u0437\u0432\u0438\u043d\u0435\u043d\u0438\u0435, (2) \u043e\u0434\u043d\u043e \u043a\u043e\u043d\u043a\u0440\u0435\u0442\u043d\u043e\u0435 \u0434\u0435\u0439\u0441\u0442\u0432\u0438\u0435 (\u00ab\u0441\u0435\u0439\u0447\u0430\u0441 \u043f\u0440\u043e\u0432\u0435\u0440\u044e \u0441\u0442\u0430\u0442\u0443\u0441 \u0434\u043e\u0441\u0442\u0430\u0432\u043a\u0438\u00bb), (3) \u043e\u0434\u0438\u043d \u043a\u043b\u044e\u0447\u0435\u0432\u043e\u0439 \u0432\u043e\u043f\u0440\u043e\u0441 \u0434\u043b\u044f \u0438\u0434\u0435\u043d\u0442\u0438\u0444\u0438\u043a\u0430\u0446\u0438\u0438 \u0437\u0430\u043a\u0430\u0437\u0430, (4) \u0431\u0435\u0437 \u043e\u043f\u0440\u0430\u0432\u0434\u0430\u043d\u0438\u0439 \u0438 \u043e\u0431\u0432\u0438\u043d\u0435\u043d\u0438\u0439, (5) \u0440\u0435\u0430\u043b\u0438\u0441\u0442\u0438\u0447\u043d\u044b\u0435 \u043e\u0431\u0435\u0449\u0430\u043d\u0438\u044f (\u0431\u0435\u0437 \u00ab\u0441\u0435\u0439\u0447\u0430\u0441 \u0432\u0441\u0451 \u0440\u0435\u0448\u0443 \u0437\u0430 1 \u043c\u0438\u043d\u0443\u0442\u0443\u00bb, \u0435\u0441\u043b\u0438 \u044d\u0442\u043e \u043d\u0435 \u0433\u0430\u0440\u0430\u043d\u0442\u0438\u0440\u043e\u0432\u0430\u043d\u043e). \u041f\u0440\u0438 \u043e\u0431\u0440\u0430\u0442\u043d\u043e\u0439 \u0441\u0432\u044f\u0437\u0438 \u0441\u0441\u044b\u043b\u0430\u0439\u0442\u0435\u0441\u044c \u043d\u0430 ISO/SOP \u0438\u0437 \u043e\u043f\u0438\u0441\u0430\u043d\u0438\u044f \u0442\u0435\u0441\u0442\u0430.",
  "ai_suggestions": [
    {
      "score": 1,
      "text": "\u042d\u043c\u043f\u0430\u0442\u0438\u0447\u043d\u043e\u0435 \u043d\u0430\u0447\u0430\u043b\u043e \u0441 \u0438\u0437\u0432\u0438\u043d\u0435\u043d\u0438\u0435\u043c, \u043e\u0434\u043d\u043e \u043a\u043e\u043d\u043a\u0440\u0435\u0442\u043d\u043e\u0435 \u0434\u0435\u0439\u0441\u0442\u0432\u0438\u0435 (\u043f\u0440\u043e\u0432\u0435\u0440\u043a\u0430 \u0441\u0442\u0430\u0442\u0443\u0441\u0430), \u043e\u0434\u0438\u043d \u0438\u0434\u0435\u043d\u0442\u0438\u0444\u0438\u0446\u0438\u0440\u0443\u044e\u0449\u0438\u0439 \u0432\u043e\u043f\u0440\u043e\u0441 (\u043d\u043e\u043c\u0435\u0440 \u0437\u0430\u043a\u0430\u0437\u0430/\u0442\u0435\u043b\u0435\u0444\u043e\u043d). \u041b\u0430\u043a\u043e\u043d\u0438\u0447\u043d\u043e, 1\u20133 \u043f\u0440\u0435\u0434\u043b\u043e\u0436\u0435\u043d\u0438\u044f."
    },
    {
      "score": 0.7,
      "text": "\u0421\u043f\u043e\u043a\u043e\u0439\u043d\u044b\u0439, \u043d\u0435 \u043e\u043f\u0440\u0430\u0432\u0434\u0430\u0442\u0435\u043b\u044c\u043d\u044b\u0439 \u0442\u043e\u043d. \u041f\u0440\u0438\u0437\u043d\u0430\u0451\u0442 \u043f\u0440\u043e\u0431\u043b\u0435\u043c\u0443, \u043d\u043e \u043c\u043e\u0436\u0435\u0442 \u043d\u0435 \u0441\u043e\u0434\u0435\u0440\u0436\u0430\u0442\u044c \u043a\u043e\u043d\u043a\u0440\u0435\u0442\u043d\u043e\u0433\u043e \u0434\u0435\u0439\u0441\u0442\u0432\u0438\u044f \u0438\u043b\u0438 \u0438\u0434\u0435\u043d\u0442\u0438\u0444\u0438\u0446\u0438\u0440\u0443\u044e\u0449\u0435\u0433\u043e \u0432\u043e\u043f\u0440\u043e\u0441\u0430."
    },
    {
      "score": 0.3,
      "text": "\u0421\u0442\u0430\u043d\u0434\u0430\u0440\u0442\u043d\u043e\u0435 \u0438\u0437\u0432\u0438\u043d\u0435\u043d\u0438\u0435 \u0431\u0435\u0437 \u043a\u043e\u043d\u043a\u0440\u0435\u0442\u043d\u043e\u0433\u043e \u0448\u0430\u0433\u0430. \u041d\u0435\u0442 \u043f\u043e\u043f\u044b\u0442\u043a\u0438 \u0443\u0442\u043e\u0447\u043d\u0438\u0442\u044c \u0434\u0430\u043d\u043d\u044b\u0435 \u0437\u0430\u043a\u0430\u0437\u0430."
    },
    {
      "score": 0,
      "text": "\u041e\u043f\u0440\u0430\u0432\u0434\u0430\u043d\u0438\u044f, \u043e\u0442\u0441\u0442\u0440\u0430\u043d\u0451\u043d\u043d\u043e\u0441\u0442\u044c \u0438\u043b\u0438 \u043e\u0431\u0432\u0438\u043d\u0435\u043d\u0438\u0435 \u043a\u043b\u0438\u0435\u043d\u0442\u0430. \u041d\u0435\u0442 \u044d\u043c\u043f\u0430\u0442\u0438\u0438, \u0434\u0435\u0439\u0441\u0442\u0432\u0438\u0439, \u0432\u043e\u043f\u0440\u043e\u0441\u0430 \u0434\u043b\u044f \u0432\u0435\u0440\u0438\u0444\u0438\u043a\u0430\u0446\u0438\u0438."
    }
  ]
}
