{
  "text": "Ночные огни: безопасная интерпретация при неопределённости.\n\nКонтекст:\nНочью вы наблюдаете: один белый огонь над одним красным по вертикали. Рядом (или ниже) вы также видите два белых топовых огня по вертикали. Чётких бортовых огней не наблюдаете.\n\nЗадание:\n1) Предложите 2–3 правдоподобные интерпретации (что это может быть).\n2) Опишите, какие дополнительные наблюдения/проверки вы сделаете, чтобы подтвердить.\n3) Опишите немедленные безопасные действия, пока вы не уверены (скорость, курс, наблюдение, связь).\n\nВажно: не «угадывайте уверенно» — покажите, как вы работаете с неопределённостью безопасно.",
  "difficulty": 4,
  "correct_answer": "Хороший подход: признать, что картина неоднозначная и потенциально опасная. Правдоподобные версии могут включать судно со специальным статусом/ограниченной манёвренностью и при этом достаточно крупное моторное судно (два топовых белых по вертикали обычно указывают на более крупное судно). Точная классификация требует дополнительного контекста (ракурс, сближение/расхождение, прочие огни, дистанция, появление бортовых огней при изменении пеленга).\n\nПроверки для подтверждения: усиленное наблюдение; небольшой безопасный сдвиг курса/ракурса, чтобы попытаться «открыть» бортовые огни; радар/AIS при наличии; оценка сближения (пеленг/дистанция); поиск дополнительных огней (кормовой, возможные огни буксировки/работ); при уместности — радиоконтакт/мониторинг VHF.\n\nНемедленные безопасные действия при неопределённости: снизить скорость до безопасной; увеличить дистанцию и CPA ранним понятным манёвром при подозрении риска; избегать прохода близко перед носом; сохранять максимальную внимательность; быть готовым быстро выполнить манёвр предотвращения столкновения. Принцип: сначала управление риском, потом классификация.",
  "explanation": "Вау-эффект здесь — демонстрация безопасного мышления при неопределённости: гипотезы, план проверки и консервативные действия.",
  "ai_context": "Оценивайте: (1) признание неоднозначности, (2) несколько правдоподобных гипотез без самоуверенности, (3) конкретные шаги проверки (ракурс/пеленг, радар/AIS, поиск дополнительных огней), (4) немедленные безопасные действия (безопасная скорость, увеличение CPA, не проходить перед носом), (5) приоритет: предотвращение столкновения важнее классификации.",
  "ai_suggestions": [
    {
      "score": 1,
      "text": "Несколько гипотез + сильный план проверки + консервативные действия; без самоуверенных «угадываний»."
    },
    {
      "score": 0.8,
      "text": "Хорошие меры безопасности и часть проверок; гипотезы правдоподобны, но их мало."
    },
    {
      "score": 0.5,
      "text": "Пытается классифицировать, но упускает меры «сначала безопасность» или нет конкретных проверок."
    },
    {
      "score": 0.2,
      "text": "Самоуверенная единичная версия; небезопасные или расплывчатые действия."
    },
    {
      "score": 0,
      "text": "Неверно и небезопасно."
    }
  ],
  "min_words": 140,
  "max_length": 2200
}
