{
  "text": "Что такое переобучение (overfitting) в машинном обучении и назовите ДВА практических способа его снизить?",
  "difficulty": 2,
  "min_words": 40,
  "max_length": 1000,
  "correct_answer": "Переобучение — когда модель слишком хорошо подгоняет обучающие данные (включая шум) и плохо обобщает. Способы: регуляризация (L2/weight decay), ранняя остановка, больше данных/аугментации, упрощение модели, dropout, кросс-валидация для подбора гиперпараметров.",
  "ai_context": "Ищите: определение (разрыв train vs test, плохое обобщение) + два прикладных способа (например, регуляризация, early stopping, аугментации, упрощение модели).",
  "ai_suggestions": [
    {
      "score": 1.0,
      "text": "Чётко определяет переобучение и приводит два (или более) корректных способа снижения с коротким объяснением."
    },
    {
      "score": 0.7,
      "text": "Корректно определяет переобучение и приводит минимум два способа, но объяснение поверхностное."
    },
    {
      "score": 0.3,
      "text": "Упоминает запоминание/обобщение, но даёт только один способ или путает понятия."
    },
    {
      "score": 0.0,
      "text": "Неверное или нерелевантное объяснение."
    }
  ]
}
