{
  "text": "«Человек за бортом»: первые 30 секунд и следующие 5 минут.\n\nКонтекст:\nДень. Человек упал за борт с вашей лодки. Ветер умеренный, волна небольшая. На борту 3 человека включая вас. Один из оставшихся членов экипажа плохо плавает.\n\nЗадание:\nОпишите:\n1) Действия в первые 30 секунд.\n2) Действия в следующие 5 минут.\n3) Чего делать нельзя.\n4) Как меняются действия ночью.\n\nОтвет — структурированный и приоритизированный (что важнее всего).",
  "difficulty": 4,
  "correct_answer": "Первые 30 секунд: поднять тревогу («человек за бортом»), непрерывно указывать на человека, назначить отдельного наблюдателя, немедленно бросить спасательное средство/маркер, и не допустить второго падения/прыжка в воду (особенно плохо плавающего). Снизить скорость и подготовить лодку к подъёму человека.\n\nСледующие 5 минут: выполнить контролируемый манёвр возврата, сохраняя человека в поле зрения; подходить медленно и предсказуемо, учитывая ветер/течение. Остановить ход/нейтраль рядом с человеком и поднимать с помощью трапа/петли/фала — не допуская опасности винта. Если сомневаетесь в возможности подъёма силами экипажа — запросить помощь раньше.\n\nЧего нельзя: потерять визуальный контакт; отправлять в воду неподготовленного/плохо плавающего; подходить на скорости; держать двигатель «в тяге» рядом; делать резкие повороты на скорости; откладывать бросок спасательного средства.\n\nНочью: критично обозначить место и не потерять человека — свет, звуковые сигналы, отметка MOB/GPS, максимальная видимость. Больше внимания профилактике (жилеты, страховка) и более консервативные решения; помощь вызывать раньше.\n\nКлюч оценки: приоритеты, распределение ролей, немедленное обеспечение плавучести/маркировки, безопасное маневрирование и предотвращение «второй жертвы».",
  "explanation": "Сильный ответ звучит как аварийный чек-лист с ролями и запретами.",
  "ai_context": "Ищите: (1) тревога + постоянное указание + отдельный наблюдатель, (2) немедленное спасательное средство/маркер, (3) предотвращение второй жертвы (не отправлять плохо плавающего), (4) медленный контролируемый подход и безопасность винта, (5) ночные меры локализации (свет, отметка MOB/GPS), (6) явный список «нельзя».",
  "ai_suggestions": [
    {
      "score": 1,
      "text": "Структурировано и приоритизировано: роли, плавучесть/маркер, безопасный подход, безопасность винта, ночные отличия и сильные пункты «нельзя»."
    },
    {
      "score": 0.8,
      "text": "Основные шаги верны, но отсутствует один критичный элемент (например, отдельный наблюдатель или риск винта)."
    },
    {
      "score": 0.5,
      "text": "Общие слова без разделения по времени, приоритетов и списка запретов."
    },
    {
      "score": 0.2,
      "text": "Есть небезопасные советы (например, отправить плохо плавающего) или подход на скорости."
    },
    {
      "score": 0,
      "text": "Неверно и небезопасно."
    }
  ],
  "min_words": 180,
  "max_length": 2600
}
