{
  "text": "Ситуация пересечения: кто уступает и почему?\n\nКонтекст:\nВы на моторном судне в открытой воде, видимость хорошая. Другое моторное судно идёт на сближение справа по носу (примерно 30–40°). Дистанция уменьшается, пеленг почти не меняется.\n\nЗадание:\n1) Определите, кто «уступающее» судно и кто «имеющее преимущество».\n2) Объясните рассуждение по шагам (как вы понимаете риск столкновения, какую логику правил применяете).\n3) Опишите, как выглядит ХОРОШИЙ манёвр уступающего (когда, насколько решительно, чего избегать).\n4) Опишите действия судна с преимуществом и момент, когда оно может/должно действовать.\n\nПишите так, будто учите студента думать, а не заучивать.",
  "difficulty": 3,
  "correct_answer": "Ключевая логика: если пеленг практически постоянен, а дистанция уменьшается — есть риск столкновения, значит нужно действовать. Для двух моторных судов при пересечении действует принцип: судно, у которого другое находится справа, обычно является уступающим. В вашем описании другое судно справа по носу — значит вы, как правило, уступающее; второе — с преимуществом.\n\nХороший манёвр уступающего: ранний и решительный, заметный окружающим; изменение курса/скорости должно быть достаточно большим, чтобы исключить двусмысленность. Обычно безопасно — заранее отвернуть вправо и пройти у него за кормой (если есть место), сохраняя наблюдение и безопасную скорость.\n\nПоведение судна с преимуществом: сначала держать курс и скорость (предсказуемость), вести постоянное наблюдение и оценивать, принимает ли уступающее судно адекватные меры. Если очевидно, что уступающее не действует, судно с преимуществом может начать манёвр уклонения; если столкновение уже нельзя предотвратить действиями уступающего в одиночку — судно с преимуществом должно действовать, выбирая наиболее безопасный вариант.\n\nКритичные замечания по безопасности: не делать мелких «почти незаметных» изменений; не полагаться на формальность правил вместо реального предотвращения столкновения; поддерживать связь/сигналы при необходимости; постоянно перепроверять обстановку.",
  "explanation": "Вопрос проверяет распознавание риска столкновения, логику расхождения и качество безопасного манёвра. Лучшие ответы — с рассуждением, а не лозунгами.",
  "ai_context": "Ищите: (1) признак риска столкновения (почти постоянный пеленг + уменьшение дистанции), (2) корректное определение уступающего/имеющего преимущество при пересечении двух моторных, (3) ранний/решительный/понятный манёвр, (4) обязанности судна с преимуществом и момент, когда оно действует, (5) приоритет безопасности и отказ от «мелких двусмысленных» манёвров.",
  "ai_suggestions": [
    {
      "score": 1,
      "text": "Верно определены роли + объяснён риск столкновения + описаны понятные безопасные манёвры обоих судов с таймингом и замечаниями по безопасности."
    },
    {
      "score": 0.8,
      "text": "В целом верная логика; небольшие ошибки терминов; манёвр описан хорошо, но отсутствует один важный нюанс (например, когда судно с преимуществом обязано действовать)."
    },
    {
      "score": 0.5,
      "text": "Часть выводов верна, но упущен признак риска столкновения или рекомендации по манёврам расплывчатые/двусмысленные."
    },
    {
      "score": 0.2,
      "text": "Перепутаны роли или предложены рискованные действия (например, проход перед носом без обоснования)."
    },
    {
      "score": 0,
      "text": "Неверно и небезопасно."
    }
  ],
  "min_words": 120,
  "max_length": 2000
}
